NOME;" TIPO";" CATEGORIA";" PP";" POWER";" ACCURACY";" DESCRIPTION";;
Dragon Pulse;Dragon;Special;10;85;100;The target is attacked with a shock wave generated by the user's gaping mouth.;;
Dragon Rush;Dragon;Physical;10;100;75;The user tackles the target while exhibiting overwhelming menace. This may also make the target flinch.;;
Power Gem;Rock;Special;20;80;100;The user attacks with a ray of light that sparkles as if it were made of gemstones.;;
Drain Punch;Fighting;Physical;10;75;100;An energy-draining punch. The user's HP is restored by half the damage taken by the target.;;
Vacuum Wave;Fighting;Special;30;40;100;The user whirls its fists to send a wave of pure vacuum at the target. This move always goes first.;;
Focus Blast;Fighting;Special;5;120;70;The user heightens its mental focus and unleashes its power. This may also lower the target's Sp. Def.;;
Energy Ball;Grass;Special;10;90;100;The user draws power from nature and fires it at the target. This may also lower the target's Sp. Def.;;
Brave Bird;Flying;Physical;15;120;100;The user tucks in its wings and charges from a low altitude. This also damages the user quite a lot.;;
Earth Power;Ground;Special;10;90;100;The user makes the ground under the target erupt with power. This may also lower the target's Sp. Def.;;
Switcheroo;Dark;Status;10;—;100;The user trades held items with the target faster than the eye can follow.;;
Giga Impact;Normal;Physical;5;150;90;The user charges at the target using every bit of its power. The user can't move on the next turn.;;
Nasty Plot;Dark;Status;20;—;—;The user stimulates its brain by thinking bad thoughts. This sharply raises the user's Sp. Atk.;;
Bullet Punch;Steel;Physical;30;40;100;The user strikes the target with tough punches as fast as bullets. This move always goes first.;;
Avalanche;Ice;Physical;10;60;100;An attack move that inflicts double the damage if the user has been hurt by the target in the same turn.;;
Ice Shard;Ice;Physical;30;40;100;The user flash-freezes chunks of ice and hurls them at the target. This move always goes first.;;
Shadow Claw;Ghost;Physical;15;70;100;The user slashes with a sharp claw made from shadows. Critical hits land more easily.;;
Thunder Fang;Electric;Physical;15;65;95;The user bites with electrified fangs. This may also make the target flinch or leave it with paralysis.;;
Ice Fang;Ice;Physical;15;65;95;The user bites with cold-infused fangs. This may also make the target flinch or leave it frozen.;;
Fire Fang;Fire;Physical;15;65;95;The user bites with flame-cloaked fangs. This may also make the target flinch or leave it with a burn.;;
Shadow Sneak;Ghost;Physical;30;40;100;The user extends its shadow and attacks the target from behind. This move always goes first.;;
Mud Bomb;Ground;Special;10;65;85;The user launches a hard-packed mud ball to attack. This may also lower the target's accuracy.;;
Psycho Cut;Psychic;Physical;20;70;100;The user tears at the target with blades formed by psychic power. Critical hits land more easily.;;
Zen Headbutt;Psychic;Physical;15;80;90;The user focuses its willpower to its head and attacks the target. This may also make the target flinch.;;
Mirror Shot;Steel;Special;10;65;85;The user lets loose a flash of energy at the target from its polished body. This may also lower the target's accuracy.;;
Flash Cannon;Steel;Special;10;80;100;The user gathers all its light energy and releases it at once. This may also lower the target's Sp. Def stat.;;
Rock Climb;Normal;Physical;20;90;85;The user attacks the target by smashing into it with incredible force. This may also confuse the target.;;
Defog;Flying;Status;15;—;∞;A strong wind blows away the target's barriers such as Reflect or Light Screen. This also lowers the target's evasiveness.;;
Trick Room;Psychic;Status;5;—;—;The user creates a bizarre area in which slower Pokémon get to move first for five turns.;;
Draco Meteor;Dragon;Special;5;130;90;Comets are summoned down from the sky onto the target. The attack's recoil harshly lowers the user's Special Attack stat.;;
Discharge;Electric;Special;15;80;100;The user strikes everything around it by letting loose a flare of electricity. This may also cause paralysis.;;
Lava Plume;Fire;Special;15;80;100;The user torches everything around it with an inferno of scarlet flames. This may also leave those hit with a burn.;;
Leaf Storm;Grass;Special;5;130;90;The user whips up a storm of leaves around the target. The attack's recoil harshly lowers the user's Sp. Atk stat.;;
Power Whip;Grass;Physical;10;120;85;The user violently whirls its vines or tentacles to harshly lash the target.;;
Rock Wrecker;Rock;Physical;5;150;90;The user launches a huge boulder at the target to attack. The user can't move on the next turn.;;
Cross Poison;Poison;Physical;20;70;100;A slashing attack with a poisonous blade that may also poison the target. Critical hits land more easily.;;
Gunk Shot;Poison;Physical;5;120;80;The user shoots filthy garbage at the target to attack. This may also poison the target.;;
Iron Head;Steel;Physical;15;80;100;The user slams the target with its steel-hard head. This may also make the target flinch.;;
Magnet Bomb;Steel;Physical;20;60;∞;The user launches steel bombs that stick to the target. This attack never misses.;;
Stone Edge;Rock;Physical;5;100;80;The user stabs the target with sharpened stones from below. Critical hits land more easily.;;
Captivate;Normal;Status;20;—;100;If any opposing Pokémon is the opposite gender of the user, it is charmed, which harshly lowers its Sp. Atk stat.;;
Stealth Rock;Rock;Status;20;—;—;The user lays a trap of levitating stones around the opposing team. The trap hurts opposing Pokémon that switch into battle.;;
Grass Knot;Grass;Special;20;—;100;The user snares the target with grass and trips it. The heavier the target, the greater the move's power.;;
Chatter;Flying;Special;20;65;100;The user attacks the target with sound waves of deafening chatter. This confuses the target.;;
Judgment;Normal;Special;10;100;100;The user releases countless shots of light at the target. This move's type varies depending on the kind of Plate the user is holding.;;
Bug Bite;Bug;Physical;20;60;100;The user bites the target. If the target is holding a Berry, the user eats it and gains its effect.;;
Charge Beam;Electric;Special;10;50;90;The user attacks with an electric charge. The user may use any remaining electricity to raise its Sp. Atk stat.;;
Wood Hammer;Grass;Physical;15;120;100;The user slams its rugged body into the target to attack. This also damages the user quite a lot.;;
Aqua Jet;Water;Physical;20;40;100;The user lunges at the target at a speed that makes it almost invisible. This move always goes first.;;
Attack Order;Bug;Physical;15;90;100;The user calls out its underlings to pummel the target. Critical hits land more easily.;;
Head Smash;Rock;Physical;5;150;80;The user attacks the target with a hazardous, full-power headbutt. This also damages the user terribly.;;
Double Hit;Normal;Physical;10;35;90;The user slams the target with a long tail, vines, or a tentacle. The target is hit twice in a row.;;
Roar of Time;Dragon;Special;5;150;90;The user blasts the target with power that distorts even time. The user can't move on the next turn.;;
Spacial Rend;Dragon;Special;5;100;95;The user tears the target along with the space around it. Critical hits land more easily.;;
Lunar Dance;Psychic;Status;10;—;—;The user faints. In return, the Pokémon taking its place will have its status and HP fully restored.;;
Crush Grip;Normal;Physical;5;—;100;The target is crushed with great force. The more HP the target has left, the greater this move's power.;;
Magma Storm;Fire;Special;5;100;75;The target becomes trapped within a maelstrom of fire that rages for four to five turns.;;
Dark Void;Dark;Status;10;—;50;Opposing Pokémon are dragged into a world of total darkness that makes them sleep.;;
Seed Flare;Grass;Special;5;120;85;The user emits a shock wave from its body to attack its target. This may harshly lower the target's Sp. Def.;;
Ominous Wind;Ghost;Special;5;60;100;The user blasts the target with a gust of repulsive wind. This may also raise all the user's stats at once.;;
Shadow Force;Ghost;Physical;5;120;100;The user disappears, then strikes the target on the next turn. This move hits even if the target protects itself.;;
Hone Claws;Dark;Status;15;—;—;The user sharpens its claws to boost its Attack stat and accuracy.;;
Wide Guard;Rock;Status;10;—;—;The user and its allies are protected from wide-ranging attacks for one turn.;;
Guard Split;Psychic;Status;10;—;—;The user employs its psychic powers to average its Defense and Sp. Def stats with those of the target.;;
Power Split;Psychic;Status;10;—;—;The user employs its psychic power to average its Attack and Sp. Atk stats with those of the target.;;
Wonder Room;Psychic;Status;10;—;—;The user creates a bizarre area in which Pokémon's Defense and Sp. Def stats are swapped for five turns.;;
Psyshock;Psychic;Special;10;80;100;The user materializes an odd psychic wave to attack the target. This attack does physical damage.;;
Venoshock;Poison;Special;10;65;100;The user drenches the target in a special poisonous liquid. This move's power is doubled if the target is poisoned.;;
Autotomize;Steel;Status;15;—;—;The user sheds part of its body to make itself lighter and sharply raise its Speed stat.;;
Rage Powder;Bug;Status;20;—;—;The user scatters a cloud of irritating powder to draw attention to itself. Opponents aim only at the user.;;
Telekinesis;Psychic;Status;15;—;—;The user makes the target float with its psychic power. The target is easier to hit for three turns.;;
Magic Room;Psychic;Status;10;—;—;The user creates a bizarre area in which Pokémon's held items lose their effects for five turns.;;
Smack Down;Rock;Physical;15;50;100;The user throws a stone or similar projectile to attack an opponent. A flying Pokémon will fall to the ground when it's hit.;;
Storm Throw;Fighting;Physical;10;60;100;The user strikes the target with a fierce blow. This attack always results in a critical hit.;;
Flame Burst;Fire;Special;15;70;100;The user attacks the target with a bursting flame. The bursting flame damages Pokémon next to the target as well.;;
Sludge Wave;Poison;Special;10;95;100;The user strikes everything around it by swamping the area with a giant sludge wave. This may also poison those hit.;;
Quiver Dance;Bug;Status;20;—;—;The user lightly performs a beautiful, mystic dance. This boosts the user's Sp. Atk, Sp. Def, and Speed stats.;;
Heavy Slam;Steel;Physical;10;—;100;The user slams into the target with its heavy body. The more the user outweighs the target, the greater the move's power.;;
Synchronoise;Psychic;Special;15;120;100;Using an odd shock wave, the user inflicts damage on any Pokémon of the same type in the area around it.;;
Electro Ball;Electric;Special;10;—;100;The user hurls an electric orb at the target. The faster the user is than the target, the greater the move's power.;;
Soak;Water;Status;20;—;100;The user shoots a torrent of water at the target and changes the target's type to Water.;;
Flame Charge;Fire;Physical;20;50;100;Cloaking itself in flame, the user attacks. Then, building up more power, the user raises its Speed stat.;;
Coil;Poison;Status;20;—;—;The user coils up and concentrates. This raises its Attack and Defense stats as well as its accuracy.;;
Low Sweep;Fighting;Physical;20;65;100;The user makes a swift attack on the target's legs, which lowers the target's Speed stat.;;
Acid Spray;Poison;Special;20;40;100;The user spits fluid that works to melt the target. This harshly lowers the target's Sp. Def stat.;;
Foul Play;Dark;Physical;15;95;100;The user turns the target's power against it. The higher the target's Attack stat, the greater the move's power.;;
Simple Beam;Normal;Status;15;—;100;The user's mysterious psychic wave changes the target's Ability to Simple.;;
Entrainment;Normal;Status;15;—;100;The user dances with an odd rhythm that compels the target to mimic it, making the target's Ability the same as the user's.;;
After You;Normal;Status;15;—;—;The user helps the target and makes it use its move right after the user.;;
Round;Normal;Special;15;60;100;The user attacks the target with a song. Others can join in the Round and make the attack do greater damage.;;
Echoed Voice;Normal;Special;15;40;100;The user attacks the target with an echoing voice. If this move is used every turn, it does greater damage.;;
Chip Away;Normal;Physical;20;70;100;Looking for an opening, the user strikes consistently. The target's stat changes don't affect this attack's damage.;;
Clear Smog;Poison;Special;15;50;—;The user attacks by throwing a clump of special mud. All stat changes are returned to normal.;;
Stored Power;Psychic;Special;10;20;100;The user attacks the target with stored power. The more the user's stats are raised, the greater the move's power.;;
Quick Guard;Fighting;Status;15;—;—;The user protects itself and its allies from priority moves.;;
Ally Switch;Psychic;Status;15;—;—;The user teleports using a strange power and switches places with one of its allies.;;
Scald;Water;Special;15;80;100;The user shoots boiling hot water at its target. This may also leave the target with a burn.;;
Shell Smash;Normal;Status;15;—;—;The user breaks its shell, which lowers Defense and Sp. Def stats but sharply raises its Attack, Sp. Atk, and Speed stats.;;
Heal Pulse;Psychic;Status;10;—;—;The user emits a healing pulse which restores the target's HP by up to half of its max HP.;;
Hex;Ghost;Special;10;65;100;This relentless attack does massive damage to a target affected by status conditions.;;
Sky Drop;Flying;Physical;10;60;100;The user takes the target into the sky, then drops it during the next turn. The target cannot attack while in the sky.;;
Shift Gear;Steel;Status;10;—;—;The user rotates its gears, raising its Attack and sharply raising its Speed.;;
Circle Throw;Fighting;Physical;10;60;90;The target is thrown, and a different Pokémon is dragged out. In the wild, this ends a battle against a single Pokémon.;;
Incinerate;Fire;Special;15;60;100;The user attacks opposing Pokémon with fire. If a Pokémon is holding a certain item, such as a Berry, the item becomes burned up and unusable.;;
Quash;Dark;Status;15;—;100;The user suppresses the target and makes its move go last.;;
Acrobatics;Flying;Physical;15;55;100;The user nimbly strikes the target. If the user is not holding an item, this attack inflicts massive damage.;;
Reflect Type;Normal;Status;15;—;—;The user reflects the target's type, making it the same type as the target.;;
Retaliate;Normal;Physical;5;70;100;The user gets revenge for a fainted ally. If an ally fainted in the previous turn, this move becomes more powerful.;;
Final Gambit;Fighting;Special;5;—;100;The user risks everything to attack its target. The user faints but does damage equal to its HP.;;
Bestow;Normal;Status;15;—;—;The user passes its held item to the target when the target isn't holding an item.;;
Inferno;Fire;Special;5;100;50;The user attacks by engulfing the target in an intense fire. This leaves the target with a burn.;;
Water Pledge;Water;Special;10;80;100;A column of water strikes the target. When combined with its fire equivalent, the damage increases and a rainbow appears.;;
Fire Pledge;Fire;Special;10;80;100;A column of fire hits opposing Pokémon. When used with its grass equivalent, its damage increases and a vast sea of fire appears.;;
Grass Pledge;Grass;Special;10;80;100;A column of grass hits the target. When used with its water equivalent, its damage increases and a vast swamp appears.;;
Volt Switch;Electric;Special;20;70;100;After making its attack, the user rushes back to switch places with a party Pokémon in waiting.;;
Struggle Bug;Bug;Special;20;50;100;While resisting, the user attacks the opposing Pokémon. This lowers the Sp. Atk stat of those hit.;;
Bulldoze;Ground;Physical;20;60;100;The user strikes everything around it by stomping down on the ground. This lowers the Speed stat of those hit.;;
Frost Breath;Ice;Special;10;60;90;The user blows its cold breath on the target. This attack always results in a critical hit.;;
Dragon Tail;Dragon;Physical;10;60;90;The target is knocked away, and a different Pokémon is dragged out. In the wild, this ends a battle against a single Pokémon.;;
Work Up;Normal;Status;30;—;—;The user is roused, and its Attack and Sp. Atk stats increase.;;
Electroweb;Electric;Special;15;55;95;The user attacks and captures opposing Pokémon by using an electric net. This lowers their Speed stat.;;
Wild Charge;Electric;Physical;15;90;100;The user shrouds itself in electricity and smashes into its target. This also damages the user a little.;;
Drill Run;Ground;Physical;10;80;95;The user crashes into its target while rotating its body like a drill. Critical hits land more easily.;;
Dual Chop;Dragon;Physical;15;40;90;The user attacks its target by hitting it with brutal strikes. The target is hit twice in a row.;;
Heart Stamp;Psychic;Physical;25;60;100;The user unleashes a vicious blow after its cute act makes the target less wary. This may also make the target flinch.;;
Horn Leech;Grass;Physical;10;75;100;The user drains the target's energy with its horns. The user's HP is restored by half the damage taken by the target.;;
Sacred Sword;Fighting;Physical;15;90;100;The user attacks by slicing with a long horn. The target's stat changes don't affect this attack's damage.;;
Razor Shell;Water;Physical;10;75;95;The user cuts its target with sharp shells. This may also lower the target's Defense stat.;;
Heat Crash;Fire;Physical;10;—;100;The user slams its target with its flame-covered body. The more the user outweighs the target, the greater the move's power.;;
Leaf Tornado;Grass;Special;10;65;90;The user attacks its target by encircling it in sharp leaves. This attack may also lower the target's accuracy.;;
Steamroller;Bug;Physical;20;65;100;The user crushes its targets by rolling over them with its rolled-up body. This attack may make the target flinch.;;
Cotton Guard;Grass;Status;10;—;—;The user protects itself by wrapping its body in soft cotton, which drastically raises the user's Defense stat.;;
Night Daze;Dark;Special;10;85;95;The user lets loose a pitch-black shock wave at its target. This may also lower the target's accuracy.;;
Psystrike;Psychic;Special;10;100;100;The user materializes an odd psychic wave to attack the target. This attack does physical damage.;;
Tail Slap;Normal;Physical;10;25;85;The user attacks by striking the target with its hard tail. It hits the target two to five times in a row.;;
Hurricane;Flying;Special;10;110;70;The user attacks by wrapping its opponent in a fierce wind that flies up into the sky. This may also confuse the target.;;
Head Charge;Normal;Physical;15;120;100;The user charges its head into its target, using its powerful guard hair. This also damages the user a little.;;
Gear Grind;Steel;Physical;15;50;85;The user attacks by throwing steel gears at its target twice.;;
Searing Shot;Fire;Special;5;100;100;The user torches everything around it with an inferno of scarlet flames. This may also leave those hit with a burn.;;
Techno Blast;Normal;Special;5;120;100;The user fires a beam of light at its target. The move's type changes depending on the Drive the user holds.;;
Relic Song;Normal;Special;10;75;100;The user sings an ancient song and attacks by appealing to the hearts of the listening opposing Pokémon. This may also induce sleep.;;
Secret Sword;Fighting;Special;10;85;100;The user cuts with its long horn. The odd power contained in the horn does physical damage to the target.;;
Glaciate;Ice;Special;10;65;95;The user attacks by blowing freezing cold air at opposing Pokémon. This lowers their Speed stat.;;
Bolt Strike;Electric;Physical;5;130;85;The user surrounds itself with a great amount of electricity and charges its target. This may also leave the target with paralysis.;;
Blue Flare;Fire;Special;5;130;85;The user attacks by engulfing the target in an intense, yet beautiful, blue flame. This may also leave the target with a burn.;;
Fusion Flare;Fire;Special;5;100;100;The user brings down a giant flame. This attack is more powerful when influenced by an enormous thunderbolt.;;
Fusion Bolt;Electric;Physical;5;100;100;The user throws down a giant thunderbolt. This move is more powerful when influenced by an enormous flame.;;